{
  "schema_version": "1.0",
  "description": "Master registry of all exercise packs. Single source of truth for navigation, discovery, and validation.",

  "navigation_groups": [
    {
      "id": "blues",
      "label": "Blues",
      "description": "Blues vocabulary, motives, and 12-key transpositions",
      "packs": ["blues_motives", "blues_motives_12key", "blues"]
    },
    {
      "id": "jazz_bebop",
      "label": "Jazz / Bebop",
      "description": "Bebop enclosures, rhythm changes, and Barry Harris method",
      "packs": ["enclosures", "got_rhythm", "barry_harris"]
    },
    {
      "id": "folk_traditional",
      "label": "Folk / Traditional",
      "description": "Bluegrass, flatpicking, fiddle tunes, and folk melodies",
      "packs": ["bluegrass"]
    },
    {
      "id": "flamenco",
      "label": "Flamenco",
      "description": "Phrygian modes, compas patterns, and palo-specific techniques",
      "packs": ["flamenco"]
    },
    {
      "id": "theory_technique",
      "label": "Theory / Technique",
      "description": "Cycles, voicings, chromatic patterns, gravity systems, and phrases",
      "packs": ["cycles", "voicings", "chromatic_triplets", "phrases", "minor_gravity", "phrygian_gravity", "pivot"]
    },
    {
      "id": "mixed",
      "label": "Mixed / Bucket A",
      "description": "Gospel, samba, walking blues, and assorted etudes",
      "packs": ["bucket_a"]
    }
  ],

  "packs": [
    {
      "id": "blues_motives",
      "title": "Blues 40 Motives",
      "status": "formalized",
      "description": "40 essential blues guitar motives across 10 archetypes",
      "style": "blues",
      "canonical_json": "blues_40_motives_canonical.json",
      "exercises_dir": "exercises/blues_motives",
      "programs_dir": "programs/blues_motives",
      "playlists_prefix": "blues_motives_",
      "exercise_count": 40,
      "program_count": 24,
      "playlist_count": 11,
      "midi_dir": null,
      "emit_scripts": ["emit_motive_pack.py"],
      "difficulty_range": ["beginner", "advanced"],
      "keys": ["E", "G", "A", "Bb", "C", "Gm", "Cm"]
    },
    {
      "id": "blues_motives_12key",
      "title": "Blues 40 Motives – 12-Key Transpositions",
      "status": "formalized",
      "description": "All 40 motives transposed to 12 major + 12 minor keys (480 exercises)",
      "style": "blues",
      "canonical_json": "blues_40_motives_canonical.json",
      "exercises_dir": "exercises/blues_motives_12key",
      "programs_dir": null,
      "playlists_prefix": "blues_motives_12key_",
      "exercise_count": 480,
      "program_count": 0,
      "playlist_count": 10,
      "midi_dir": null,
      "emit_scripts": ["emit_12key_packs.py"],
      "difficulty_range": ["intermediate", "advanced"],
      "keys": "all_24"
    },
    {
      "id": "blues",
      "title": "Blues Turnarounds & Licks",
      "status": "formalized",
      "description": "Blues turnarounds, licks, and backing tracks in multiple keys",
      "style": "blues",
      "canonical_json": "blues_canonical.json",
      "exercises_dir": "exercises/blues",
      "programs_dir": null,
      "playlists_prefix": "blues_",
      "exercise_count": 8,
      "program_count": 5,
      "playlist_count": 5,
      "midi_dir": null,
      "midi_legacy_count": 7,
      "emit_scripts": ["emit_blues_pack.py"],
      "difficulty_range": ["beginner", "advanced"],
      "keys": ["E", "G", "Cm"]
    },
    {
      "id": "enclosures",
      "title": "Bebop Enclosures",
      "status": "formalized",
      "description": "14 chromatic approach patterns targeting chord tones over jazz harmony",
      "style": "jazz",
      "canonical_json": "enclosures_canonical.json",
      "exercises_dir": "exercises/enclosures",
      "programs_dir": null,
      "playlists_prefix": "enclosure_",
      "exercise_count": 14,
      "program_count": 14,
      "playlist_count": 10,
      "midi_dir": "exercises/enclosures/midi",
      "midi_count": 42,
      "emit_scripts": ["emit_enclosure_pack.py", "emit_enclosure_midi.py"],
      "difficulty_range": ["beginner", "advanced"],
      "keys": ["C"]
    },
    {
      "id": "got_rhythm",
      "title": "Got Rhythm – Barry Harris Studies",
      "status": "formalized",
      "description": "4 progressive bebop studies over rhythm changes (Barry Harris method)",
      "style": "jazz",
      "canonical_json": "got_rhythm_canonical.json",
      "exercises_dir": "exercises/got_rhythm",
      "programs_dir": null,
      "playlists_prefix": "got_rhythm_",
      "exercise_count": 4,
      "program_count": 4,
      "playlist_count": 4,
      "midi_dir": "exercises/got_rhythm/midi",
      "midi_count": 12,
      "emit_scripts": ["emit_got_rhythm_pack.py", "emit_got_rhythm_midi.py"],
      "difficulty_range": ["beginner", "advanced"],
      "keys": ["Bb", "Eb"]
    },
    {
      "id": "flamenco",
      "title": "Flamenco Palos & Techniques",
      "status": "formalized",
      "description": "20 exercises across 8 palos with Phrygian modes and compas patterns",
      "style": "flamenco",
      "canonical_json": "flamenco_canonical.json",
      "exercises_dir": "exercises/flamenco",
      "programs_dir": null,
      "playlists_prefix": "flamenco_",
      "exercise_count": 20,
      "program_count": 12,
      "playlist_count": 19,
      "midi_dir": "exercises/flamenco/midi",
      "midi_count": 36,
      "emit_scripts": ["emit_flamenco_pack.py", "emit_flamenco_midi.py"],
      "difficulty_range": ["beginner", "advanced"],
      "keys": ["E", "A", "D", "G", "Am"]
    },
    {
      "id": "bluegrass",
      "title": "Bluegrass & Traditional Flatpicking",
      "status": "formalized",
      "description": "14 exercises: G licks, folk melodies, fiddle tunes, and intro phrases",
      "style": "folk",
      "canonical_json": "bluegrass_canonical.json",
      "exercises_dir": "exercises/bluegrass",
      "programs_dir": null,
      "playlists_prefix": "bluegrass_",
      "exercise_count": 14,
      "program_count": 12,
      "playlist_count": 7,
      "midi_dir": "exercises/bluegrass/midi",
      "midi_count": 36,
      "emit_scripts": ["emit_bluegrass_pack.py", "emit_bluegrass_midi.py"],
      "difficulty_range": ["beginner", "advanced"],
      "keys": ["G", "A", "C"]
    },
    {
      "id": "barry_harris",
      "title": "Barry Harris Scales",
      "status": "unformalized",
      "description": "Dominant 7th and major 7th bebop scale exercises with 12-key MIDI",
      "style": "jazz",
      "canonical_json": null,
      "exercises_dir": "exercises/barry_harris_dom7",
      "exercises_dir_2": "exercises/barry_harris_maj7",
      "programs_dir": null,
      "playlists_prefix": null,
      "exercise_count": 2,
      "program_count": 2,
      "playlist_count": 0,
      "midi_dir": null,
      "midi_legacy_count": 24,
      "emit_scripts": [],
      "difficulty_range": ["intermediate", "advanced"],
      "keys": "all_12"
    },
    {
      "id": "cycles",
      "title": "Cycle Training",
      "status": "unformalized",
      "description": "Circle of 5ths, 4ths, 3rds, dominants, and tritone substitution cycles",
      "style": "theory",
      "canonical_json": null,
      "exercises_dir": "exercises/cycles",
      "programs_dir": null,
      "playlists_prefix": "cycle_",
      "exercise_count": 6,
      "program_count": 0,
      "playlist_count": 1,
      "midi_dir": null,
      "emit_scripts": [],
      "difficulty_range": ["intermediate", "advanced"],
      "keys": ["C"]
    },
    {
      "id": "voicings",
      "title": "Chord Voicings & Drop-2",
      "status": "unformalized",
      "description": "Drop-2 voicings, backdoor cadence shells, diminished cycles, contrary motion",
      "style": "jazz",
      "canonical_json": null,
      "exercises_dir": "exercises/voicings",
      "programs_dir": null,
      "playlists_prefix": "voicing_",
      "exercise_count": 5,
      "program_count": 5,
      "playlist_count": 2,
      "midi_dir": null,
      "midi_legacy_count": 5,
      "emit_scripts": [],
      "difficulty_range": ["intermediate", "advanced"],
      "keys": ["C"]
    },
    {
      "id": "phrases",
      "title": "Blues Phrases & Joe Pass Etudes",
      "status": "unformalized",
      "description": "Blues intro phrases and Joe Pass-inspired jazz etudes",
      "style": "jazz",
      "canonical_json": null,
      "exercises_dir": "exercises/phrases",
      "programs_dir": null,
      "playlists_prefix": "blues_phrases_",
      "exercise_count": 8,
      "program_count": 8,
      "playlist_count": 1,
      "midi_dir": null,
      "midi_legacy_count": 8,
      "emit_scripts": [],
      "difficulty_range": ["intermediate", "advanced"],
      "keys": ["G", "E"]
    },
    {
      "id": "chromatic_triplets",
      "title": "Chromatic Triplet Chains",
      "status": "unformalized",
      "description": "Chromatic triplet approach patterns over dim7, ii-V-I, and maj6 harmony",
      "style": "jazz",
      "canonical_json": null,
      "exercises_dir": "exercises/chromatic_triplets",
      "programs_dir": null,
      "playlists_prefix": "chromatic_triplet_",
      "exercise_count": 3,
      "program_count": 3,
      "playlist_count": 1,
      "midi_dir": null,
      "midi_legacy_count": 3,
      "emit_scripts": [],
      "difficulty_range": ["intermediate", "advanced"],
      "keys": ["C"]
    },
    {
      "id": "minor_gravity",
      "title": "Minor Gravity Techniques",
      "status": "unformalized",
      "description": "Harmonic minor b9 resolution and melodic minor guidetone exercises",
      "style": "theory",
      "canonical_json": null,
      "exercises_dir": "exercises/minor_gravity",
      "programs_dir": null,
      "playlists_prefix": null,
      "exercise_count": 2,
      "program_count": 0,
      "playlist_count": 0,
      "midi_dir": null,
      "emit_scripts": [],
      "difficulty_range": ["intermediate", "advanced"],
      "keys": ["D", "C"]
    },
    {
      "id": "phrygian_gravity",